;Natasha_no_hyphen1;Tokens;Lemmas;wh_words
3039;Амос, эта палочка уже сказала нам все, что могла, – будь добр, можно Гарри ее заберет?;21;['амос', ',', 'этот', 'палочка', 'уже', 'сказать', 'мы', 'весь', ',', 'что', 'мочь', ',', '–', 'быть', 'добрый', ',', 'можно', 'гарри', 'она', 'забрать', '?'];что
3040;Что теперь будет с Винки?;6;['что', 'теперь', 'быть', 'с', 'винк', '?'];что
3042;Пап, а чего все так испугались этого черепа?;10;['папа', ',', 'а', 'что', 'весь', 'так', 'испугаться', 'этот', 'череп', '?'];что
3043;Что случилось, Артур?;5;['что', 'случиться', ',', 'артур', '?'];что
3046;Пап, в чем дело?;6;['папа', ',', 'в', 'что', 'дело', '?'];что
3062;Что все это значит?;5;['что', 'весь', 'это', 'значить', '?'];что
3068;Ведь и в самом деле никто не пострадал, что же мне было говорить?;15;['ведь', 'и', 'в', 'сам', 'дело', 'никто', 'не', 'пострадать', ',', 'что', 'же', 'я', 'быть', 'говорить', '?'];что
3073;В чем дело, Гарри?;6;['в', 'что', 'дело', ',', 'гарри', '?'];что
3077;А помните, что предсказала профессор Трелони?;8;['а', 'помнить', ',', 'что', 'предсказать', 'профессор', 'трелонь', '?'];что
3079;Ой, Гарри, и ты будешь верить всему, что плетет эта старая дура?;16;['ой', ',', 'гарри', ',', 'и', 'ты', 'быть', 'верить', 'весь', ',', 'что', 'плести', 'этот', 'старый', 'дура', '?'];что
3084;Что это вы двое там делаете?;7;['что', 'это', 'вы', 'двое', 'там', 'делать', '?'];что
3087;Если «Хогварц-экспресс» завтра потерпит крушение и мы с Джорджем погибнем, каково тебе будет помнить, что напоследок ты предъявила нам несправедливые обвинения?;26;['если', '«', 'хогварц-экспресс', '»', 'завтра', 'потерпеть', 'крушение', 'и', 'мы', 'с', 'джордж', 'погибнуть', ',', 'каков', 'ты', 'быть', 'помнить', ',', 'что', 'напоследок', 'ты', 'предъявить', 'мы', 'несправедливый', 'обвинение', '?'];что
3088;Мы ведь уже выяснили, что эта Винки, хотя и очень безответственная, Знака все же несоздавала?;19;['мы', 'ведь', 'уже', 'выяснить', ',', 'что', 'этот', 'винка', ',', 'хотя', 'и', 'очень', 'безответственный', ',', 'знак', 'все', 'же', 'несоздавала', '?'];что
3091;А это еще что за гадость?;7;['а', 'это', 'еще', 'что', 'за', 'гадость', '?'];что
3095;А сам Шизоглаз что говорит?;6;['а', 'сам', 'шизоглаз', 'что', 'говорить', '?'];что
3096;А что мусорные баки?;5;['а', 'что', 'мусорный', 'бак', '?'];что
3099;Но подумай, если отдел неправомочного использования колдовства заберет Шизоглаза, он, считай, пропал – ты вспомни его досье! – надо его как-то отмазать, по какому-нибудь мелкому обвинению, по твоему ведомству – что там полагается за стреляющую помойку?;44;['но', 'подумать', ',', 'если', 'отдел', 'неправомочный', 'использование', 'колдовство', 'забрать', 'шизоглаз', ',', 'он', ',', 'считай', ',', 'пропасть', '–', 'ты', 'вспомнить', 'его', 'досье', '!', '–', 'надо', 'он', 'как-то', 'отмазать', ',', 'по', 'какой-нибудь', 'мелкий', 'обвинение', ',', 'по', 'твой', 'ведомство', '–', 'что', 'там', 'полагаться', 'за', 'стрелять', 'помойка', '?'];что
3108;Что он еще натворил?;5;['что', 'он', 'еще', 'натворить', '?'];что
3112;Ага, и знаешь еще что, Перси?;9;['ага', ',', 'и', 'знать', 'еще', 'что', ',', 'перси', '?'];что
3117;Чего это вы все темните?;6;['что', 'это', 'вы', 'весь', 'темнить', '?'];что
3121;Да скажите же, что такое будет в «Хогварце»?;12;['да', 'сказать', 'же', ',', 'что', 'такой', 'быть', 'в', '«', 'хогварц', '»', '?'];что
3122;Что за правила изменили?;5;['что', 'за', 'правило', 'изменить', '?'];что
3130;Значит, посторонние думают, что «Дурмштранг» – тоже развалины?;13;['значить', ',', 'посторонний', 'думать', ',', 'что', '«', 'дурмштранг', '»', '–', 'тоже', 'развалины', '?'];что
3132;Уизли… а это что еще за пакость?;9;['уизли', '…', 'а', 'это', 'что', 'еще', 'за', 'пакость', '?'];что
3136;О чем ты?;4;['о', 'что', 'ты', '?'];что
3144;Гарри, знаешь что?;5;['гарри', ',', 'знать', 'что', '?'];что
3145;Знаешь что, Гарри?;5;['знать', 'что', ',', 'гарри', '?'];что
3152;Интересно, подумал Гарри, знает ли этот Бэддок, что из «Слизерина» вышло больше всего черных магов?;21;['интересный', ',', 'подумать', 'гарри', ',', 'знать', 'ли', 'этот', 'бэддок', ',', 'что', 'из', '«', 'слизерин', '»', 'выйти', 'больше', 'весь', 'черный', 'маг', '?'];что
3158;Что ‘учиось?;4;['что', '‘', 'учиося', '?'];что
3159;Так что он там наделал, в кухне?;9;['так', 'что', 'он', 'там', 'наделать', ',', 'в', 'кухня', '?'];что
3170;Что с ним такое?;5;['что', 'с', 'он', 'такой', '?'];что
3171;Что у него слицом?;5;['что', 'у', 'он', 'слицом', '?'];что
3172;О чем бишь я?;5;['о', 'что', 'бишь', 'я', '?'];что
3175;А что за беспристрастный судья выбирает чемпионов?;8;['а', 'что', 'за', 'беспристрастный', 'судья', 'выбирать', 'чемпион', '?'];что
3189;Что ониделают?;3;['что', 'ониделать', '?'];что
3190;Фу, Огрид, что это у них за острая штука?;12;['фу', ',', 'огрид', ',', 'что', 'это', 'у', 'они', 'за', 'острый', 'штука', '?'];что
3196;Ничего он сейчас не опасается… если, конечно, не считать тревоги за судьбу Сириуса… но что она знает, эта Трелони?;25;['ничто', 'он', 'сейчас', 'не', 'опасаться', '…', 'если', ',', 'конечно', ',', 'не', 'считать', 'тревога', 'за', 'судьба', 'сириус', '…', 'но', 'что', 'она', 'знать', ',', 'этот', 'трелонь', '?'];что
3203;Что, много задали?;5;['что', ',', 'много', 'задать', '?'];что
3204;Ну что?;3;['ну', 'что', '?'];что
3207;Так что, его мамаша и впрямь жирная или на фотографии плохо вышла?;14;['так', 'что', ',', 'его', 'мамаша', 'и', 'впрямь', 'жирный', 'или', 'на', 'фотография', 'плохо', 'выйти', '?'];что
3212;Что «отставить»?;5;['что', '«', 'отставить', '»', '?'];что
3213;Что вы делаете?;4;['что', 'вы', 'делать', '?'];что
3215;Хмури,это что, ученик?;7;['хмурь', ',', 'это', 'что', ',', 'ученик', '?'];что
3222;Что знает?;3;['что', 'знать', '?'];что
3223;Что делается?;3;['что', 'делаться', '?'];что
3227;А вы что, не останетесь?;7;['а', 'вы', 'что', ',', 'не', 'остаться', '?'];что
3243;Интересно, что на обед, – умираю с голоду, а вы?;14;['интересный', ',', 'что', 'на', 'обед', ',', '–', 'умирать', 'с', 'голод', ',', 'а', 'вы', '?'];что
3244;Невилл, что с тобой?;6;['невилл', ',', 'что', 'с', 'ты', '?'];что
3245;Очень интересный обед – в смысле урок – что там на еду?;13;['очень', 'интересный', 'обед', '–', 'в', 'смысл', 'урок', '–', 'что', 'там', 'на', 'еда', '?'];что
3246;Невилл, что?;4;['невилл', ',', 'что', '?'];что
3248;Что это было?;4;['что', 'это', 'быть', '?'];что
3252;А у Хмури с Думбльдором не будет неприятностей, если в министерстве узнают, что мы видели эти проклятия?;20;['а', 'у', 'хмурь', 'с', 'думбльдор', 'не', 'быть', 'неприятность', ',', 'если', 'в', 'министерство', 'узнавать', ',', 'что', 'мы', 'видеть', 'этот', 'проклятие', '?'];что
3253;Ну что, пойдем возьмем прорицательские бумажки?;8;['ну', 'что', ',', 'пойти', 'взять', 'прорицательский', 'бумажка', '?'];что
3261;Что, правда?;4;['что', ',', 'правда', '?'];что
3263;Что там у тебя?;5;['что', 'там', 'у', 'ты', '?'];что
3266;Да что ты?;4;['да', 'что', 'ты', '?'];что
3271;Что там?;3;['что', 'там', '?'];что
3275;Гарри… что?;4;['гарри', '…', 'что', '?'];что
3276;О чем ты?;4;['о', 'что', 'ты', '?'];что
3277;Подумаешь, поболело три секунды – что же, сразу жаловаться?;12;['подумать', ',', 'поболеть', 'три', 'секунда', '–', 'что', 'же', ',', 'сразу', 'жаловаться', '?'];что
3279;И что?;3;['и', 'что', '?'];что
3291;А что крах?;4;['а', 'что', 'крах', '?'];что
3296;О чем ты?;4;['о', 'что', 'ты', '?'];что
3313;Интересно, что там с ними?;7;['интересный', ',', 'что', 'там', 'с', 'они', '?'];что
3321;И вообще, что мешало им взять плащи?;9;['и', 'вообще', ',', 'что', 'мешать', 'они', 'взять', 'плащ', '?'];что
3328;Это еще что такое?;5;['это', 'еще', 'что', 'такой', '?'];что
3332;Что они здесь делают?;5;['что', 'они', 'здесь', 'делать', '?'];что
3333;По телу Гарри пробежала приятная дрожь – интересно, что сейчас будет?;13;['по', 'тело', 'гарри', 'пробежать', 'приятный', 'дрожь', '–', 'интересный', ',', 'что', 'сейчас', 'быть', '?'];что
3334;Что внесут?;3;['что', 'внести', '?'];что
3345;Что приняли?;3;['что', 'принять', '?'];что
3350;Так что мы сегодня будем делать?;7;['так', 'что', 'мы', 'сегодня', 'быть', 'делать', '?'];что
3358;Огрид, что это?;5;['огрид', ',', 'что', 'это', '?'];что
3360;Чего, не нравится?;5;['что', ',', 'не', 'нравиться', '?'];что
3365;Что же он нас не подождал?;7;['что', 'же', 'он', 'мы', 'не', 'подождать', '?'];что
3366;Что слючилось?;3;['что', 'слючилось', '?'];что
3370;Что все это значит, Думбли-догг?;7;['что', 'весь', 'это', 'значить', ',', 'думбль-догга', '?'];что
3375;Чего вам еще?;4;['что', 'вы', 'еще', '?'];что
3376;Вы, конечно, согласитесь, что все это ввысшей степени несообразно?;13;['вы', ',', 'конечно', ',', 'согласиться', ',', 'что', 'весь', 'это', 'ввыснуть', 'степень', 'несообразный', '?'];что
3388;Вы уверены, что не хотите остаться на ночь в «Хогварце», Барти?;16;['вы', 'уверить', ',', 'что', 'не', 'хотеть', 'остаться', 'на', 'ночь', 'в', '«', 'хогварц', '»', ',', 'барти', '?'];что
3392;Интересно, поверит ли ему кто-нибудь, кроме Рона и Гермионы, или все решат, что он смухлевал?;20;['интересный', ',', 'поверить', 'ли', 'он', 'кто-нибудь', ',', 'кроме', 'рон', 'и', 'гермиона', ',', 'или', 'весь', 'решить', ',', 'что', 'он', 'смухлевать', '?'];что
3403;Что значит, поздравляю?;5;['что', 'значить', ',', 'поздравлять', '?'];что
3404;Что ты сделал – надел плащ-невидимку?;7;['что', 'ты', 'сделать', '–', 'надеть', 'плащ-невидимка', '?'];что
3413;Он все еще думает, что я подал заявку?;10;['он', 'все', 'еще', 'думать', ',', 'что', 'я', 'подать', 'заявка', '?'];что
3414;Что это значит –не так чтобы?;7;['что', 'это', 'значить', '–не', 'так', 'чтобы', '?'];что
3415;Ой, Гарри, ты что, не понимаешь?;10;['ой', ',', 'гарри', ',', 'ты', 'что', ',', 'не', 'понимать', '?'];что
3417;Чему завидует?;3;['что', 'завидовать', '?'];что
3418;Он что, хотел бы вместо меня сесть в лужу перед всей школой, да?;16;['он', 'что', ',', 'хотеть', 'бы', 'вместо', 'я', 'сесть', 'в', 'лужа', 'перед', 'весь', 'школа', ',', 'да', '?'];что
3419;Гарри, я тут подумала… ты ведь знаешь, что надо сделать, да?;16;['гарри', ',', 'я', 'тут', 'подумать', '…', 'ты', 'ведь', 'знать', ',', 'что', 'надо', 'сделать', ',', 'да', '?'];что
3431;Так ты веришь, что я не сам?;9;['так', 'ты', 'верить', ',', 'что', 'я', 'не', 'сам', '?'];что
3432;Чемпион школы… и чего только с тобой не приключалось, да?;13;['чемпион', 'школа', '…', 'и', 'что', 'только', 'с', 'ты', 'не', 'приключаться', ',', 'да', '?'];что
3436;И что это здесь за шум?;7;['и', 'что', 'это', 'здесь', 'за', 'шум', '?'];что
3440;Что ты чемпион?;4;['что', 'ты', 'чемпион', '?'];что
3441;Колин, а для чего нас будут фотографировать?;9;['колин', ',', 'а', 'для', 'что', 'мы', 'быть', 'фотографировать', '?'];что
3492;А что, ваш глаз?;6;['а', 'что', ',', 'ваш', 'глаз', '?'];что
3495;Что это он затевает?;5;['что', 'это', 'он', 'затевать', '?'];что
3497;В чем дело?;4;['в', 'что', 'дело', '?'];что
3498;Что ты мне хочешь показать?;6;['что', 'ты', 'я', 'хотеть', 'показать', '?'];что
3501;Огрид, что?;4;['огрид', ',', 'что', '?'];что
3502;Ах, Ог’ид… что, уже вгемя?;11;['ах', ',', 'ог', '’', 'ида', '…', 'что', ',', 'уже', 'вгемить', '?'];что
3503;Огрид что, хотел показать ему мадам Максим?;9;['огрид', 'что', ',', 'хотеть', 'показать', 'он', 'мадам', 'максим', '?'];что
3505;Только… никому не говорите, что я вам показал, ладно?;13;['только', '…', 'никто', 'не', 'говорить', ',', 'что', 'я', 'вы', 'показать', ',', 'ладно', '?'];что
3510;Чемпионы не должны знать, что их ждет, – а она ведь своим обязательно скажет?;17;['чемпион', 'не', 'должный', 'знать', ',', 'что', 'они', 'ждать', ',', '–', 'а', 'она', 'ведь', 'свой', 'обязательно', 'сказать', '?'];что
3512;А чего с ними делать – сразиться?;8;['а', 'что', 'с', 'они', 'делать', '–', 'сразиться', '?'];что
3514;Против огнедышащего, пятидесятифутового, бронированного шипастого дракона у него будет только волшебная палочка – а что она, в сущности, такое?;24;['против', 'огнедышащий', ',', 'пятидесятифутовой', ',', 'бронировать', 'шипастый', 'дракон', 'у', 'он', 'быть', 'только', 'волшебный', 'палочка', '–', 'а', 'что', 'она', ',', 'в', 'сущность', ',', 'такой', '?'];что
3520;О чем?;3;['о', 'что', '?'];что
3521;Настроение Гарри упало еще на несколько делений… что может быть хуже драконов?;14;['настроение', 'гарри', 'упасть', 'еще', 'на', 'несколько', 'деление', '…', 'что', 'мочь', 'быть', 'хуже', 'дракон', '?'];что
3523;Так он… что?;5;['так', 'он', '…', 'что', '?'];что
3527;Так что ты хочешь сказать?;6;['так', 'что', 'ты', 'хотеть', 'сказать', '?'];что
3532;А пропала она в Албании – и, по слухам, там в последний раз видели Вольдеморта… и ведь она знала, что в этом году возродят Тремудрые Турниры – правильно?;33;['а', 'пропасть', 'она', 'в', 'албания', '–', 'и', ',', 'по', 'слух', ',', 'там', 'в', 'последний', 'раз', 'видеть', 'вольдеморт', '…', 'и', 'ведь', 'она', 'знать', ',', 'что', 'в', 'этот', 'год', 'возродить', 'тремудрые', 'турнир', '–', 'правильно', '?'];что
3541;Ты-то что тут делаешь среди ночи?;7;['ты-то', 'что', 'тут', 'делать', 'среди', 'ночь', '?'];что
3544;Есть, конечно, превращальные заклинания… но что от них толку?;13;['быть', ',', 'конечно', ',', 'превращальный', 'заклинание', '…', 'но', 'что', 'от', 'они', 'толк', '?'];что
3556;Слышал ли тот, о чем они говорили?;9;['слышать', 'ли', 'тот', ',', 'о', 'что', 'они', 'говорить', '?'];что
3560;А это что?;4;['а', 'это', 'что', '?'];что
3563;Ну что… узнал про драконов, а?;9;['ну', 'что', '…', 'узнать', 'про', 'дракон', ',', 'а', '?'];что
3565;Что ты умеешь лучше всего?;6;['что', 'ты', 'уметь', 'хороший', 'весь', '?'];что
3567;А что ему нужно?;5;['а', 'что', 'он', 'нужный', '?'];что
3568;А я что, по-твоему, пытаюсь делать?;9;['а', 'я', 'что', ',', 'по-твоему', ',', 'пытаться', 'делать', '?'];что
3569;А я что делаю?;5;['а', 'я', 'что', 'делать', '?'];что
3582;Ну – что нам скажут судьи?;7;['ну', '–', 'что', 'мы', 'сказать', 'судья', '?'];что
3584;В том году дементоры, теперь драконы, что еще они в школу притащат?;15;['в', 'тот', 'год', 'дементор', ',', 'теперь', 'дракон', ',', 'что', 'еще', 'они', 'в', 'школа', 'притащить', '?'];что
3588;Но… меня же поранили… что это он?;10;['но', '…', 'я', 'же', 'поранить', '…', 'что', 'это', 'он', '?'];что
3596;И что ты думаешьтеперьо справедливости судей?;7;['и', 'что', 'ты', 'думаешьтеперьо', 'справедливость', 'судья', '?'];что
3598;Помнишь, в поезде Малфой говорил, что Каркаров – друг его папаши?;14;['помнить', ',', 'в', 'поезд', 'малфа', 'говорить', ',', 'что', 'каркаров', '–', 'друг', 'он', 'папаша', '?'];что
3599;Знаешь что?;3;['знать', 'что', '?'];что
3600;Ну чего, пошли вниз?;6;['ну', 'что', ',', 'пойти', 'вниз', '?'];что
3601;Что это было?;4;['что', 'это', 'быть', '?'];что
3606;А что?;3;['а', 'что', '?'];что
3621;Э-э-э… да, пожалуй, чего ж нет-то?;10;['э-э-э', '…', 'да', ',', 'пожалуй', ',', 'что', 'ж', 'нет-то', '?'];что
3626;Что случилось?;3;['что', 'случиться', '?'];что
3627;Я могу и так повисеть, нараспашку, пока вы не соизволите вернуться, так, что ли?;19;['я', 'мочь', 'и', 'так', 'повисеть', ',', 'нараспашку', ',', 'пока', 'вы', 'не', 'соизволить', 'вернуться', ',', 'так', ',', 'что', 'ли', '?'];что
3634;Добби, что ты тут делаешь?;7;['добби', ',', 'что', 'ты', 'тут', 'делать', '?'];что
3644;А домовые эльфы не могут говорить про своего хозяина то, что думают?;14;['а', 'домовый', 'эльф', 'не', 'мочь', 'говорить', 'про', 'свой', 'хозяин', 'тот', ',', 'что', 'думать', '?'];что
3645;А про Малфоев ты теперь можешь говорить все, что хочешь?;12;['а', 'про', 'малфоев', 'ты', 'теперь', 'мочь', 'говорить', 'весь', ',', 'что', 'хотеть', '?'];что
3646;Мой бедный, бедный мистер Сгорбс, что он будет делать без своей Винки?;15;['мой', 'бедный', ',', 'бедный', 'мистер', 'сгорбс', ',', 'что', 'он', 'быть', 'делать', 'без', 'свой', 'винка', '?'];что
3653;Знаете что?;3;['знать', 'что', '?'];что
3655;Интересно, что такого говорил про него Сгорбс дома?;10;['интересный', ',', 'что', 'такой', 'говорить', 'про', 'он', 'сгорбс', 'дома', '?'];что
3656;А чего такого?;4;['а', 'что', 'такой', '?'];что
3660;И чего они всегда стайками?;6;['и', 'что', 'они', 'всегда', 'стайка', '?'];что
3665;А потом задумался: волновало бы его это, если бы его пригласила Чо?;15;['а', 'потом', 'задуматься', ':', 'волновать', 'бы', 'он', 'это', ',', 'если', 'бы', 'он', 'пригласить', 'что', '?'];что
3695;В чем дело?;4;['в', 'что', 'дело', '?'];что
3697;Что сделал?;3;['что', 'сделать', '?'];что
3699;Что на меня нашло?;5;['что', 'на', 'я', 'найти', '?'];что
3710;Что на них на всех нашло?;7;['что', 'на', 'они', 'на', 'весь', 'найти', '?'];что
3718;Так что насчет Рона?;5;['так', 'что', 'насчет', 'рон', '?'];что
3720;Скажи мне тогда, что она ответит, ладно?;10;['сказать', 'я', 'тогда', ',', 'что', 'она', 'ответить', ',', 'ладно', '?'];что
3724;Только не говори, что кто-то решился пригласитьэтона бал?;10;['только', 'не', 'говорить', ',', 'что', 'кто-то', 'решиться', 'пригласитьэтон', 'бал', '?'];что
3726;Что мои зубы?;4;['что', 'мой', 'зуб', '?'];что
3736;Ну что, пойдем вниз, Гарри?;8;['ну', 'что', ',', 'пойти', 'вниз', ',', 'гарри', '?'];что
