;Natasha_no_hyphen1;Tokens;Lemmas;wh_words
5573;Что плохого в здоровом, добром «П»?;10;['что', 'плохой', 'в', 'здоровый', ',', 'добрый', '«', 'п', '»', '?'];что
5577;Это что?;3;['это', 'что', '?'];что
5581;А что у вас после обеда?;7;['а', 'что', 'у', 'вы', 'после', 'обед', '?'];что
5585;А что брать-то?;4;['а', 'что', 'брать-то', '?'];что
5594;Что на этот раз, мисс Грейнджер?;8;['что', 'на', 'этот', 'раз', ',', 'мисс', 'грейнджер', '?'];что
5599;За что?;3;['за', 'что', '?'];что
5608;Ты, конечно, считаешь, что Макгонаголл права, да?;12;['ты', ',', 'конечно', ',', 'считать', ',', 'что', 'макгонаголл', 'право', ',', 'да', '?'];что
5622;А что мы можем с этим поделать?;8;['а', 'что', 'мы', 'мочь', 'с', 'это', 'поделать', '?'];что
5623;Что «сами»?;5;['что', '«', 'сам', '»', '?'];что
5624;Тебе что, уроков не хватает?;7;['ты', 'что', ',', 'урок', 'не', 'хватать', '?'];что
5625;Ты что, не видишь – мы с Гарри и так не справляемся с домашними заданиями?;17;['ты', 'что', ',', 'не', 'видеть', '–', 'мы', 'с', 'гарри', 'и', 'так', 'не', 'справляться', 'с', 'домашний', 'задание', '?'];что
5629;Чтобы я что?;4;['чтобы', 'я', 'что', '?'];что
5633;Знаешь что?;3;['знать', 'что', '?'];что
5642;А вы помните, что я говорил?;8;['а', 'вы', 'помнить', ',', 'что', 'я', 'говорить', '?'];что
5643;Что во многом это было везение?;7;['что', 'в', 'многое', 'это', 'быть', 'везение', '?'];что
5645;И что же говорил наш дорогой Викки?;8;['и', 'что', 'же', 'говорить', 'наш', 'дорогой', 'викки', '?'];что
5647;А если и да, то что?;8;['а', 'если', 'и', 'да', ',', 'то', 'что', '?'];что
5648;Я что, не могу переписываться с друзьями?;9;['я', 'что', ',', 'не', 'мочь', 'переписываться', 'с', 'друг', '?'];что
5657;Что делать, если им навстречу бросится огромный черный пес?;11;['что', 'делать', ',', 'если', 'они', 'навстречу', 'броситься', 'огромный', 'черный', 'пес', '?'];что
5660;Он сказал, что его уведомили, будто ты хочешь заказать навозные бомбы?;14;['он', 'сказать', ',', 'что', 'он', 'уведомить', ',', 'будто', 'ты', 'хотеть', 'заказать', 'навозный', 'бомба', '?'];что
5666;Тебе не приходило в голову, что под этой тряпкой может оказаться Кхембридж?;14;['ты', 'не', 'приходить', 'в', 'голова', ',', 'что', 'под', 'этот', 'тряпка', 'мочь', 'оказаться', 'кхембридж', '?'];что
5667;Вам чего?;3;['вы', 'что', '?'];что
5668;Знаете что?;3;['знать', 'что', '?'];что
5672;Ну а что?;4;['ну', 'а', 'что', '?'];что
5674;Что ты им сказала?;5;['что', 'ты', 'они', 'сказать', '?'];что
5675;Чего они ждут?;4;['что', 'они', 'ждать', '?'];что
5681;А правда, – перебила девочка с длинной косой, глядя на Гарри, – что ты умеешь вызывать Заступника?;21;['а', 'правда', ',', '–', 'перебить', 'девочка', 'с', 'длинный', 'коса', ',', 'глядеть', 'на', 'гарри', ',', '–', 'что', 'ты', 'уметь', 'вызывать', 'заступник', '?'];что
5687;Хорош юлить, ты умеешь, а мы что, рыжие?;12;['хороший', 'юлить', ',', 'ты', 'уметь', ',', 'а', 'мы', 'что', ',', 'рыжий', '?'];что
5693;Ну а что?;4;['ну', 'а', 'что', '?'];что
5701;Что мне было делать?;5;['что', 'я', 'быть', 'делать', '?'];что
5704;Джинни встречается… моя сестра встречается… то есть что, с этим Майклом?;15;['джинни', 'встречаться', '…', 'мой', 'сестра', 'встречаться', '…', 'тот', 'быть', 'что', ',', 'с', 'этот', 'майкл', '?'];что
5713;Это что же, они закроют клуб побрякуш?;9;['это', 'что', 'же', ',', 'они', 'закрыть', 'клуб', 'побрякуша', '?'];что
5718;Я что, знал?;5;['я', 'что', ',', 'знать', '?'];что
5721;А что бы с ним случилось?;7;['а', 'что', 'бы', 'с', 'он', 'случиться', '?'];что
5725;Что будем делать?;4;['что', 'быть', 'делать', '?'];что
5726;Что делать?;3;['что', 'делать', '?'];что
5730;Что, если она испугаетсяуказа и решит не посещать собрания?;11;['что', ',', 'если', 'она', 'испугаетсяуказ', 'и', 'решить', 'не', 'посещать', 'собрание', '?'];что
5731;Вы что, не понимаете?;6;['вы', 'что', ',', 'не', 'понимать', '?'];что
5744;Что с Хедвигой?;4;['что', 'с', 'хедвига', '?'];что
5747;Понимаешь, я только что говорила Рону… а вдруг Хедвигу пытались перехватить?;14;['понимать', ',', 'я', 'только', 'что', 'говорить', 'рон', '…', 'а', 'вдруг', 'хедвиг', 'пытаться', 'перехватить', '?'];что
5756;Во имя Мерлина, что это было?;8;['в', 'имя', 'мерлин', ',', 'что', 'это', 'быть', '?'];что
5764;Или я настолько бездарный преподаватель, что даже не научила вас открывать книги?;14;['или', 'я', 'настолько', 'бездарный', 'преподаватель', ',', 'что', 'даже', 'не', 'научить', 'вы', 'открывать', 'книга', '?'];что
5769;Что обдумать?;3;['что', 'обдумать', '?'];что
5779;А что он делал в «Башке борова»?;10;['а', 'что', 'он', 'делать', 'в', '«', 'башка', 'боров', '»', '?'];что
5800;Вы в курсе, что до первой игры осталось всего три недели?;13;['вы', 'в', 'курс', ',', 'что', 'до', 'первый', 'игра', 'остаться', 'всего', 'три', 'неделя', '?'];что
5801;Гермиона, ты что?;5;['гермиона', ',', 'ты', 'что', '?'];что
5810;Что это значит, «через нас»?;9;['что', 'это', 'значить', ',', '«', 'через', 'мы', '»', '?'];что
5812;А что, правда действуют?;6;['а', 'что', ',', 'правда', 'действовать', '?'];что
5815;Что случилось?;3;['что', 'случиться', '?'];что
5816;В чем дело?;4;['в', 'что', 'дело', '?'];что
5819;Ты что, видел его?;6;['ты', 'что', ',', 'видеть', 'он', '?'];что
5821;Или что?;3;['или', 'что', '?'];что
5826;А что?;3;['а', 'что', '?'];что
5827;Нет, но… знаешь, что ты делаешь?;10;['нет', ',', 'но', '…', 'знать', ',', 'что', 'ты', 'делать', '?'];что
5829;Что так нужно Вольдеморту?;5;['что', 'так', 'нужный', 'вольдеморт', '?'];что
5830;Что происходит медленнее, чем ему бы хотелось?;9;['что', 'происходить', 'медленный', ',', 'чем', 'он', 'бы', 'хотеться', '?'];что
5838;Ты собираешьвсе,что связала Гермиона?;7;['ты', 'собираешьвс', ',', 'что', 'связать', 'гермиона', '?'];что
5851;Что это тут?;4;['что', 'это', 'тут', '?'];что
5853;Гарри, а это что за штуки?;8;['гарри', ',', 'а', 'это', 'что', 'за', 'штука', '?'];что
5854;Что, Гермиона?;4;['что', ',', 'гермиона', '?'];что
5859;«Доблестная армия»? – сказала Чо.;9;['«', 'доблестный', 'армия', '»', '?', '–', 'сказать', 'что', '.'];что
5872;Так что, будем пользоваться галлеонами?;7;['так', 'что', ',', 'быть', 'пользоваться', 'галлеон', '?'];что
5873;Знаешь, что мне это напоминает?;7;['знать', ',', 'что', 'я', 'это', 'напоминать', '?'];что
5876;Как-то в коридоре слизеринцы – в том числе семиклассники, здоровенные парни, – проходя мимо, негромко спросили: «Ну что, Уизли, не забыл заказать себе койку в лазарете?;34;['как-то', 'в', 'коридор', 'слизеринец', '–', 'в', 'тот', 'число', 'семиклассник', ',', 'здоровенный', 'парень', ',', '–', 'проходить', 'мимо', ',', 'негромко', 'спросить', ':', '«', 'ну', 'что', ',', 'уизли', ',', 'не', 'забыть', 'заказать', 'себя', 'койка', 'в', 'лазарет', '?'];что
5878;Что мне вообще взбрело?;5;['что', 'я', 'вообще', 'взбрести', '?'];что
5881;Гарри вслушивался изо всех сил, хотя в ушах выл ветер, а на трибунах шумели, кричали, вопили, пели… – …обходит Уоррингтона, уворачивается от Нападалы – чуть не попалась, Алисия! – зрители ликуют, кстати, что это там поют?;49;['гарри', 'вслушиваться', 'из', 'весь', 'сила', ',', 'хотя', 'в', 'ухо', 'выл', 'ветер', ',', 'а', 'на', 'трибуна', 'шуметь', ',', 'кричать', ',', 'вопить', ',', 'петь', '…', '–', '…', 'обходить', 'уоррингтон', ',', 'уворачиваться', 'от', 'нападалы', '–', 'чуть', 'не', 'попасться', ',', 'алисия', '!', '–', 'зритель', 'ликовать', ',', 'кстати', ',', 'что', 'это', 'там', 'петь', '?'];что
5882;Гарри, ТЫ ЧТО, ЗАСНУЛ?;7;['гарри', ',', 'ты', 'что', ',', 'заснуть', '?'];что
5884;Что, спас своего дружка?;6;['что', ',', 'спасти', 'свой', 'дружок', '?'];что
5886;Пусть проорется, он бесится, что проиграл, паршивый жалкий… – …но ты ведь любишь эту семейку, правда, Поттер?;25;['пусть', 'проораться', ',', 'он', 'беситься', ',', 'что', 'проиграть', ',', 'паршивый', 'жалкий', '…', '–', '…', 'но', 'ты', 'ведь', 'любить', 'этот', 'семейка', ',', 'правда', ',', 'поттер', '?'];что
5888;Ты что?;3;['ты', 'что', '?'];что
5891;Что за отвратительные выходки?;5;['что', 'за', 'отвратительный', 'выходка', '?'];что
5896;Что значит «помочь»?;6;['что', 'значить', '«', 'помочь', '»', '?'];что
5903;Что же нам теперь делать?;6;['что', 'же', 'мы', 'теперь', 'делать', '?'];что
5909;За что?;3;['за', 'что', '?'];что
5914;Что это с тобой?;5;['что', 'это', 'с', 'ты', '?'];что
5917;А если б у кого-нибудь из нас вместо физиономии была отбивная, ты бы тоже сказал, что это ерунда?;21;['а', 'если', 'б', 'у', 'кто-нибудь', 'из', 'мы', 'вместо', 'физиономия', 'быть', 'отбивной', ',', 'ты', 'бы', 'тоже', 'сказать', ',', 'что', 'это', 'ерунда', '?'];что
5927;Вот оно, значит, чего?;7;['вот', 'оно', ',', 'значить', ',', 'что', '?'];что
5947;И что, нельзя было колдовать?;7;['и', 'что', ',', 'нельзя', 'быть', 'колдовать', '?'];что
5951;Перво-наперво гиганты колдунов не жалуют – чего ж нам их сразу злить?;13;['перво-наперво', 'гигант', 'колдун', 'не', 'жаловать', '–', 'что', 'ж', 'мы', 'они', 'сразу', 'злить', '?'];что
5957;Вы их увидели – а дальше что?;8;['вы', 'они', 'увидеть', '–', 'а', 'далекий', 'что', '?'];что
5965;А что дарят гигантам?;5;['а', 'что', 'дарить', 'гигант', '?'];что
5968;А что сказал Гург?;5;['а', 'что', 'сказать', 'гург', '?'];что
5969;Да ты что?;4;['да', 'ты', 'что', '?'];что
5974;И что он сказал?;5;['и', 'что', 'он', 'сказать', '?'];что
5977;И чего – два дня назад братались со старым Гургом, а теперь к новому лезть?;17;['и', 'что', '–', 'два', 'день', 'назад', 'брататься', 'с', 'старый', 'гург', ',', 'а', 'теперь', 'к', 'новый', 'лезть', '?'];что
5983;А чего ж ты так долго возвращался, если вы пробыли там всего три дня?;16;['а', 'что', 'ж', 'ты', 'так', 'долго', 'возвращаться', ',', 'если', 'вы', 'пробыть', 'там', 'всего', 'три', 'день', '?'];что
5984;Что, он еще кому-то голову оторвал?;8;['что', ',', 'он', 'еще', 'кто-то', 'голова', 'оторвать', '?'];что
5985;А что?;3;['а', 'что', '?'];что
5999;Что значит «в какой-то момент», Огрид?;10;['что', 'значить', '«', 'в', 'какой-то', 'момент', '»', ',', 'огрид', '?'];что
6009;А это еще что?;5;['а', 'это', 'еще', 'что', '?'];что
6012;А что с вами произошло?;6;['а', 'что', 'с', 'вы', 'произойти', '?'];что
6034;Уверен, что приручил?;5;['уверенный', ',', 'что', 'приручить', '?'];что
6035;А что тогда с лицом?;6;['а', 'что', 'тогда', 'с', 'лицо', '?'];что
6038;Прошу прощения, – раздался насмешливый голос Малфоя, – но что, собственно, мы должны видеть?;19;['просить', 'прощение', ',', '–', 'раздаться', 'насмешливый', 'голос', 'малфой', ',', '–', 'но', 'что', ',', 'собственно', ',', 'мы', 'должный', 'видеть', '?'];что
6043;С извещением о том, что я приду с проверкой на ваш урок?;14;['с', 'извещение', 'о', 'тот', ',', 'что', 'я', 'прийти', 'с', 'проверка', 'на', 'ваш', 'урок', '?'];что
6046;Что вы сказали?;4;['что', 'вы', 'сказать', '?'];что
6047;Чего я говорил?;4;['что', 'я', 'говорить', '?'];что
6048;А вам известно, – громогласно перебила Кхембридж, – что министерство магии относит этих животных к разряду «опасных»?;22;['а', 'вы', 'известный', ',', '–', 'громогласно', 'перебить', 'кхембридж', ',', '–', 'что', 'министерство', 'магия', 'относить', 'этот', 'животное', 'к', 'разряд', '«', 'опасный', '»', '?'];что
6054;И что вы о них думаете?;7;['и', 'что', 'вы', 'о', 'они', 'думать', '?'];что
6055;Вы поняли, что она затеяла?;7;['вы', 'понять', ',', 'что', 'она', 'затеять', '?'];что
6058;Я что, не говорил?;6;['я', 'что', ',', 'не', 'говорить', '?'];что
6060;Впрочем, что об этом думать, если Думбльдор, скорее всего, не разрешит Сириусу покинуть дом на площади Мракэнтлен?;22;['впрочем', ',', 'что', 'о', 'это', 'думать', ',', 'если', 'думбльдор', ',', 'скорый', 'весь', ',', 'не', 'разрешить', 'сириус', 'покинуть', 'дом', 'на', 'площадь', 'мракэнтлен', '?'];что
6069;В чем де?;4;['в', 'что', 'де', '?'];что
6070;Что с тобой?;4;['что', 'с', 'ты', '?'];что
6074;Что ты так долго?;5;['что', 'ты', 'так', 'долго', '?'];что
6076;Да что такое-то?;4;['да', 'что', 'такой-то', '?'];что
6077;Что случилось?;3;['что', 'случиться', '?'];что
6080;И что же она… э-э… хотела?;9;['и', 'что', 'же', 'она', '…', 'э-э', '…', 'хотеть', '?'];что
6085;Ой, – улыбка Рона слегка увяла, – ты что, так плохо целуешься?;16;['ой', ',', '–', 'улыбка', 'рон', 'слегка', 'увянуть', ',', '–', 'ты', 'что', ',', 'так', 'плохо', 'целоваться', '?'];что
6087;Что ты такое говоришь?;5;['что', 'ты', 'такой', 'говорить', '?'];что
6096;Что за глупости, – рассеянно отмахнулась Гермиона, – она давным-давно ему нравится, правда, Гарри?;19;['что', 'за', 'глупость', ',', '–', 'рассеянный', 'отмахнуться', 'гермиона', ',', '–', 'она', 'давным-давно', 'он', 'нравиться', ',', 'правда', ',', 'гарри', '?'];что
6100;Что она нашла в этом Круме?;7;['что', 'она', 'найти', 'в', 'это', 'крум', '?'];что
6101;Да, но что еще?;6;['да', ',', 'но', 'что', 'еще', '?'];что
6108;Что такое, Поттер?;5;['что', 'такой', ',', 'поттер', '?'];что
6110;Что значит «своими глазами»?;7;['что', 'значить', '«', 'свой', 'глаз', '»', '?'];что
6111;Вы хотите сказать, что это вам приснилось?;9;['вы', 'хотеть', 'сказать', ',', 'что', 'это', 'вы', 'присниться', '?'];что
6133;Что случилось?;3;['что', 'случиться', '?'];что
6137;Что – вернулись, изменники, выродки?;8;['что', '–', 'вернуться', ',', 'изменник', ',', 'выродок', '?'];что
6138;Это правда, что их отец умирает?;8;['это', 'правда', ',', 'что', 'они', 'отец', 'умирать', '?'];что
6139;Что случилось?;3;['что', 'случиться', '?'];что
6147;А что же тогда было в кабинете Думбльдора?;9;['а', 'что', 'же', 'тогда', 'быть', 'в', 'кабинет', 'думбльдор', '?'];что
6152;Вдруг он проснется, а выяснится, что он снова обернулся змеей и напал, например, на Рона?;20;['вдруг', 'он', 'проснуться', ',', 'а', 'выясниться', ',', 'что', 'он', 'снова', 'обернуться', 'змея', 'и', 'напасть', ',', 'например', ',', 'на', 'рон', '?'];что
6167;Что же его держат в общей палате?;8;['что', 'же', 'он', 'держать', 'в', 'общий', 'палата', '?'];что
6169;А больной что сказал?;5;['а', 'больной', 'что', 'сказать', '?'];что
6174;И что дальше было с Уилли Уиздесуйерсом, Артур?;10;['и', 'что', 'далекий', 'быть', 'с', 'уилли', 'уиздесуйерс', ',', 'артур', '?'];что
6179;Гарри, ты, кажется, говорил, что у Сам-Знаешь-Кого есть змея?;14;['гарри', ',', 'ты', ',', 'казаться', ',', 'говорить', ',', 'что', 'у', 'сам-знаешь-кий', 'быть', 'змея', '?'];что
6184;Но вряд ли Сам-Знаешь-Кто рассчитывал, что змее удастся пробраться внутрь?;12;['но', 'вряд', 'ли', 'сам-знаешь-кто', 'рассчитывать', ',', 'что', 'змея', 'удаться', 'пробраться', 'внутрь', '?'];что
6185;Стало быть, Поттер утверждает, что все видел?;10;['стать', 'быть', ',', 'поттер', 'утверждать', ',', 'что', 'весь', 'видеть', '?'];что
6186;"Боится, что из ярко-зеленых они вдруг превратятся в кроваво-красные с кошачьими прорезями зрачков; боится встретиться взглядом с Вольдемортом?";21;"['бояться', ',', 'что', 'из', 'ярко-зеленый', 'они', 'вдруг', 'превратиться', 'в', 'кроваво-красный', 'с', 'кошачий', 'прорезь', 'зрачок', ';', 'бояться', 'встретиться', 'взглядом', 'с', 'вольдеморт', '?']";что
6187;А что еще ему нужно, кроме сторонников?;9;['а', 'что', 'еще', 'он', 'нужный', ',', 'кроме', 'сторонник', '?'];что
6190;Гарри, детка, что с тобой?;8;['гарри', ',', 'детка', ',', 'что', 'с', 'ты', '?'];что
6192;Гарри, милый, тыуверен,что нормально себя чувствуешь?;11;['гарри', ',', 'милый', ',', 'тыуверить', ',', 'что', 'нормально', 'себя', 'чувствовать', '?'];что
6197;Я что, анимаг?;5;['я', 'что', ',', 'анимаг', '?'];что
6200;Что, если его следующей жертвой станет Шеймас, или Дин, или Невилл?;15;['что', ',', 'если', 'его', 'следующий', 'жертва', 'стать', 'шеймас', ',', 'или', 'дин', ',', 'или', 'невилл', '?'];что
6202;Мне казалось, – Финей Нигеллий любовно огладил острую бородку, – что в колледж «Гриффиндор» зачисляютхрабрецов?;20;['я', 'казаться', ',', '–', 'финей', 'нигеллия', 'любовно', 'огладить', 'острый', 'бородка', ',', '–', 'что', 'в', 'колледж', '«', 'гриффиндор', '»', 'зачисляютхрабрец', '?'];что
6204;Так что за сообщение?;5;['так', 'что', 'за', 'сообщение', '?'];что
6207;Что еще он сказал?;5;['что', 'еще', 'он', 'сказать', '?'];что
6210;А не приходило ли в твою глупую голову, несчастный ты самоуверенный задавака, что у директора школы «Хогварц» имеются очень веские основания не посвящать тебя во все свои планы?;33;['а', 'не', 'приходить', 'ли', 'в', 'твой', 'глупый', 'голова', ',', 'несчастный', 'ты', 'самоуверенный', 'задавака', ',', 'что', 'у', 'директор', 'школа', '«', 'хогварц', '»', 'иметься', 'очень', 'веский', 'основание', 'не', 'посвящать', 'ты', 'в', 'весь', 'свой', 'план', '?'];что
6214;Думбльдор велел оставаться… наверно, это значит, что спать все-таки можно… но страшно… а если все повторится?;22;['думбльдор', 'велеть', 'оставаться', '…', 'наверно', ',', 'это', 'значить', ',', 'что', 'спать', 'все-таки', 'можно', '…', 'но', 'страшный', '…', 'а', 'если', 'весь', 'повториться', '?'];что
6220;Ты помнишь все, что ты делал?;8;['ты', 'помнить', 'весь', ',', 'что', 'ты', 'делать', '?'];что
