;Natasha_no_hyphen1;Tokens;Lemmas;wh_words
8014;Итак, – строго заговорила она, – что случилось?;11;['итак', ',', '–', 'строго', 'заговорить', 'она', ',', '–', 'что', 'случиться', '?'];что
8021;Потому что не хотел трогать, разве не ясно?;10;['потому', 'что', 'не', 'хотеть', 'трогать', ',', 'разве', 'не', 'ясный', '?'];что
8046;Что за школа?;4;['что', 'за', 'школа', '?'];что
8060;И что бы я ни сказала, ничего не изменится?;11;['и', 'что', 'бы', 'я', 'ни', 'сказать', ',', 'ничто', 'не', 'измениться', '?'];что
8064;Надеюсь, вы понимаете, что мы не сможем держать его у себя постоянно?;15;['надеяться', ',', 'вы', 'понимать', ',', 'что', 'мы', 'не', 'смочь', 'держать', 'он', 'у', 'себя', 'постоянно', '?'];что
8074;А то, что я умею… это колдовство?;10;['а', 'тот', ',', 'что', 'я', 'уметь', '…', 'это', 'колдовство', '?'];что
8075;А что ты умеешь?;5;['а', 'что', 'ты', 'уметь', '?'];что
8078;Там есть то, что тебе не принадлежит?;9;['там', 'быть', 'тот', ',', 'что', 'ты', 'не', 'принадлежать', '?'];что
8087;Что встретил самого страшного черного колдуна всех времен?;9;['что', 'встретить', 'сам', 'страшный', 'черный', 'колдун', 'весь', 'время', '?'];что
8088;Во-первых, надеюсь, ты заметил реакцию Реддля на то, что еще кого-тозовут его именем, «Том»?;21;['во-первых', ',', 'надеяться', ',', 'ты', 'заметить', 'реакция', 'реддля', 'на', 'тот', ',', 'что', 'еще', 'кого-тозвать', 'его', 'имя', ',', '«', 'том', '»', '?'];что
8089;Наверняка ты заметил и то, что Том Реддль с детства был крайне самодостаточен, скрытен и не имел друзей?;21;['наверняка', 'ты', 'заметить', 'и', 'тот', ',', 'что', 'том', 'реддль', 'с', 'детство', 'быть', 'крайне', 'самодостаточный', ',', 'скрытный', 'и', 'не', 'иметь', 'друг', '?'];что
8103;Что тебе?;3;['что', 'ты', '?'];что
8113;То есть что, я псих?;7;['тот', 'быть', 'что', ',', 'я', 'псих', '?'];что
8118;С чего это?;4;['с', 'что', 'это', '?'];что
8122;И знаете что?;4;['и', 'знать', 'что', '?'];что
8131;Что, он считает себя героем?;7;['что', ',', 'он', 'считать', 'себя', 'герой', '?'];что
8135;И что ты сделаешь, выдашь нас?;8;['и', 'что', 'ты', 'сделать', ',', 'выдать', 'мы', '?'];что
8136;О чем это вы?;5;['о', 'что', 'это', 'вы', '?'];что
8142;Такое впечатление, что он хочет съесть ее губы, правда?;12;['такой', 'впечатление', ',', 'что', 'он', 'хотеть', 'съесть', 'ее', 'губа', ',', 'правда', '?'];что
8146;Что ж ты его не конфисковала?;7;['что', 'ж', 'ты', 'он', 'не', 'конфисковать', '?'];что
8149;Но говорили, что всех сов обыскивают?;8;['но', 'говорить', ',', 'что', 'весь', 'сова', 'обыскивать', '?'];что
8156;Или, может, она слышала, что ты говорила про Филча?;13;['или', ',', 'мочь', ',', 'она', 'слышать', ',', 'что', 'ты', 'говорить', 'про', 'филча', '?'];что
8158;Гермиона оглянулась на Гарри через плечо: дескать, что я говорила?;13;['гермиона', 'оглянуться', 'на', 'гарри', 'через', 'плечо', ':', 'дескать', ',', 'что', 'я', 'говорить', '?'];что
8159;Ты знаешь, что у тебя одна бровь ярко-желтая?;10;['ты', 'знать', ',', 'что', 'у', 'ты', 'один', 'бровь', 'ярко-желтый', '?'];что
8177;Вы что, встречаетесь?;5;['вы', 'что', ',', 'встречаться', '?'];что
8182;Ты слышала, что там будет вампир?;8;['ты', 'слышать', ',', 'что', 'там', 'быть', 'вампир', '?'];что
8184;Я… что?;4;['я', '…', 'что', '?'];что
8188;Что с тобой?;4;['что', 'с', 'ты', '?'];что
8192;Ты и правда считаешь, что я способна пасть так низко?;12;['ты', 'и', 'правда', 'считать', ',', 'что', 'я', 'способный', 'пасть', 'так', 'низко', '?'];что
8200;Разве директор не говорил, что без специального разрешения шляться по ночам запрещено?;14;['разве', 'директор', 'не', 'говорить', ',', 'что', 'без', 'специальный', 'разрешение', 'шляться', 'по', 'ночь', 'запретить', '?'];что
8206;В последний раз – я ни при чем, понятно?;11;['в', 'последний', 'раз', '–', 'я', 'ни', 'при', 'что', ',', 'понятный', '?'];что
8207;Что за мысли ты пытаешься скрыть от своего господина, Драко?;12;['что', 'за', 'мысль', 'ты', 'пытаться', 'скрыть', 'от', 'свой', 'господин', ',', 'драко', '?'];что
8211;Что за план?;4;['что', 'за', 'план', '?'];что
8218;А что?;3;['а', 'что', '?'];что
8219;А что будет, если нарушишь?;7;['а', 'что', 'быть', ',', 'если', 'нарушить', '?'];что
8220;Я извиняюсь, что опустить?;6;['я', 'извиняться', ',', 'что', 'опустить', '?'];что
8221;Что это за история о тебе и юной прелестнице по имени – если информация, полученная от Джинни, верна – Лаванда Браун?;24;['что', 'это', 'за', 'история', 'о', 'ты', 'и', 'юный', 'прелестница', 'по', 'имя', '–', 'если', 'информация', ',', 'получить', 'от', 'джинни', ',', 'верный', '–', 'лаванда', 'браун', '?'];что
8224;Ее что, кирпичом контузило?;6;['она', 'что', ',', 'кирпич', 'контузить', '?'];что
8229;Что вам стоит?;4;['что', 'вы', 'стоить', '?'];что
8232;Ты, конечно, знаешь, что тебе скажут?;10;['ты', ',', 'конечно', ',', 'знать', ',', 'что', 'ты', 'сказать', '?'];что
8239;Мистер Уизли, помните, что я говорил на вокзале перед отъездом в школу?;15;['мистер', 'уизли', ',', 'помнить', ',', 'что', 'я', 'говорить', 'на', 'вокзал', 'перед', 'отъезд', 'в', 'школа', '?'];что
8246;А чем вы сейчас занимаетесь?;6;['а', 'что', 'вы', 'сейчас', 'заниматься', '?'];что
8256;Ты что, хочешь взять такой титул?;8;['ты', 'что', ',', 'хотеть', 'взять', 'такой', 'титул', '?'];что
8260;Она что, издевается?;5;['она', 'что', ',', 'издеваться', '?'];что
8261;Что это?;3;['что', 'это', '?'];что
8265;Вдруг ты случайно проговорился, что мечтаешь расхаживать в ошейнике с надписью: «Моя любовь»?;18;['вдруг', 'ты', 'случайно', 'проговориться', ',', 'что', 'мечтать', 'расхаживать', 'в', 'ошейник', 'с', 'надпись', ':', '«', 'мой', 'любовь', '»', '?'];что
8268;Что, на Рождество домовым эльфам принято дарить подарки?;10;['что', ',', 'на', 'рождество', 'домовый', 'эльф', 'принятый', 'дарить', 'подарок', '?'];что
8280;И что же говорит Думбльдор?;6;['и', 'что', 'же', 'говорить', 'думбльдор', '?'];что
8285;Ну, что скажешь, Гарри?;7;['ну', ',', 'что', 'сказать', ',', 'гарри', '?'];что
8286;«Примкнуть к министерству»… что это значит?;10;['«', 'примкнуть', 'к', 'министерство', '»', '…', 'что', 'это', 'значить', '?'];что
8287;В душе Гарри стремительно закипала ярость: то есть что, Долорес Кхембридж оставили в министерстве?;17;['в', 'душа', 'гарри', 'стремительно', 'закипать', 'ярость', ':', 'тот', 'быть', 'что', ',', 'долорес', 'кхембридж', 'оставить', 'в', 'министерство', '?'];что
8289;Но ведь, если я буду мелькать в министерстве, – продолжал Гарри, пока еще вежливо, – люди могут решить, что я одобряю вашу политику?;29;['но', 'ведь', ',', 'если', 'я', 'быть', 'мелькать', 'в', 'министерство', ',', '–', 'продолжать', 'гарри', ',', 'пока', 'еще', 'вежливо', ',', '–', 'человек', 'мочь', 'решить', ',', 'что', 'я', 'одобрять', 'ваш', 'политика', '?'];что
8293;Вы же сказали, что это не важно?;9;['вы', 'же', 'сказать', ',', 'что', 'это', 'не', 'важный', '?'];что
8294;Что сейчас делает Думбльдор?;5;['что', 'сейчас', 'делать', 'думбльдор', '?'];что
8298;Он такой дебил, что не великапотеря, правда?;10;['он', 'такой', 'дебил', ',', 'что', 'не', 'великапотеря', ',', 'правда', '?'];что
8299;Что значит «нет»?;6;['что', 'значить', '«', 'нет', '»', '?'];что
8302;Что это с ней?;5;['что', 'это', 'с', 'она', '?'];что
8305;А что было у Ронюсика?;6;['а', 'что', 'быть', 'у', 'ронюсик', '?'];что
8307;Ну, говори, что за важные новости?;9;['ну', ',', 'говорить', ',', 'что', 'за', 'важный', 'новость', '?'];что
8327;В чем дело?;4;['в', 'что', 'дело', '?'];что
8328;Думбльдор действительно приказал Злею выяснить, что затевает Малфой, и давно знает обо всем от Злея?;18;['думбльдор', 'действительно', 'приказать', 'злеть', 'выяснить', ',', 'что', 'затевать', 'малфа', ',', 'и', 'давно', 'знать', 'о', 'весь', 'от', 'злея', '?'];что
8329;Или он просто притворяется, что ничуть не встревожен?;10;['или', 'он', 'просто', 'притворяться', ',', 'что', 'ничуть', 'не', 'встревожить', '?'];что
8330;Значит, сэр, – Гарри надеялся, что его голос звучит спокойно и вежливо, – вы по-прежнему доверяете?;21;['значить', ',', 'сэр', ',', '–', 'гарри', 'надеяться', ',', 'что', 'его', 'голос', 'звучать', 'спокойно', 'и', 'вежливо', ',', '–', 'вы', 'по-прежнему', 'доверять', '?'];что
8331;Что, если он не желает менять тему, а хочет говорить о Малфое, отстаивать свою позицию?;19;['что', ',', 'если', 'он', 'не', 'желать', 'менять', 'тема', ',', 'а', 'хотеть', 'говорить', 'о', 'малфой', ',', 'отстаивать', 'свой', 'позиция', '?'];что
8334;Ну что, поехали?;5;['ну', 'что', ',', 'поехать', '?'];что
8353;А Морфин так и не понял, что никого не убивал?;12;['а', 'морфин', 'так', 'и', 'не', 'понять', ',', 'что', 'никто', 'не', 'убивать', '?'];что
8358;Сэр, а правда, что профессор Потешанс уходит на пенсию?;12;['сэр', ',', 'а', 'правда', ',', 'что', 'профессор', 'потешанс', 'уходить', 'на', 'пенсия', '?'];что
8363;Что в нем особенного?;5;['что', 'в', 'он', 'особенный', '?'];что
8373;Блейз… что у тебя?;6;['блейза', '…', 'что', 'у', 'ты', '?'];что
8374;Что ты мне покажешь?;5;['что', 'ты', 'я', 'показать', '?'];что
8377;Что ты сказал?;4;['что', 'ты', 'сказать', '?'];что
8387;Что значит «безразлично»?;6;['что', 'значить', '«', 'безразличный', '»', '?'];что
8388;Ты что, не хочешь научиться аппарировать?;8;['ты', 'что', ',', 'не', 'хотеть', 'научиться', 'аппарировать', '?'];что
8389;Ты когда-нибудь объяснишь, что мы делаем?;8;['ты', 'когда-нибудь', 'объяснить', ',', 'что', 'мы', 'делать', '?'];что
8390;Видишь, что мама с папой подарили?;8;['видеть', ',', 'что', 'мама', 'с', 'папа', 'подарить', '?'];что
8395;Ты же только что говорил?;6;['ты', 'же', 'только', 'что', 'говорить', '?'];что
8398;Что нестерпимо?;3;['что', 'нестерпимый', '?'];что
8405;За что?;3;['за', 'что', '?'];что
8406;Что на тебя на?;5;['что', 'на', 'ты', 'на', '?'];что
8419;Он что, ее прячет?;6;['он', 'что', ',', 'она', 'прятать', '?'];что
8423;Что, опомнился?;4;['что', ',', 'опомниться', '?'];что
8431;Вам не кажется, что он случайно перепутал кубки?;10;['вы', 'не', 'казаться', ',', 'что', 'он', 'случайно', 'перепутать', 'кубок', '?'];что
8441;С чего ты взяла?;5;['с', 'что', 'ты', 'взять', '?'];что
8442;Гарри, Гарри, что тут сказать?;8;['гарри', ',', 'гарри', ',', 'что', 'тут', 'сказать', '?'];что
8450;Ты чего, хочешь, чтоб меня с работы турнули?;11;['ты', 'что', ',', 'хотеть', ',', 'чтоб', 'я', 'с', 'работа', 'турнуть', '?'];что
8451;Что сделал Злей?;4;['что', 'сделать', 'злеть', '?'];что
8452;И что?;3;['и', 'что', '?'];что
8453;Что делать?;3;['что', 'делать', '?'];что
8455;Ну и что?;4;['ну', 'и', 'что', '?'];что
8457;Значит, он считает, что Злей недостаточно усердно допрашивает слизеринцев… а может быть, одного слизеринца: Малфоя?;21;['значить', ',', 'он', 'считать', ',', 'что', 'злеть', 'недостаточно', 'усердно', 'допрашивать', 'слизеринец', '…', 'а', 'мочь', 'быть', ',', 'один', 'слизеринец', ':', 'малфой', '?'];что
8459;Боялся, что Гарри натворит глупостей, полезет в это дело сам?;13;['бояться', ',', 'что', 'гарри', 'натворит', 'глупость', ',', 'полезть', 'в', 'это', 'дело', 'сам', '?'];что
8466;Его пытались отравить, что тут интересного?;8;['он', 'пытаться', 'отравить', ',', 'что', 'тут', 'интересный', '?'];что
8472;И что?;3;['и', 'что', '?'];что
8477;Что случилось?;3;['что', 'случиться', '?'];что
8485;Что сделать?;3;['что', 'сделать', '?'];что
8487;Что такое?;3;['что', 'такой', '?'];что
8494;А из-за чего?;4;['а', 'из-за', 'что', '?'];что
8499;Кстати, что это?;5;['кстати', ',', 'что', 'это', '?'];что
8503;Во-первых – удалось ли тебе выполнить то, о чем я попросил в конце прошлого занятия?;17;['во-первых', '–', 'удаться', 'ли', 'ты', 'выполнить', 'тот', ',', 'о', 'что', 'я', 'попросить', 'в', 'конец', 'прошлый', 'занятие', '?'];что
8504;И теперь ты считаешь, что сделал все возможное?;10;['и', 'теперь', 'ты', 'считать', ',', 'что', 'сделать', 'весь', 'возможный', '?'];что
8508;Стало быть, я могу надеяться, что с сегодняшнего дня это дело станет для тебя главным?;18;['стать', 'быть', ',', 'я', 'мочь', 'надеяться', ',', 'что', 'с', 'сегодняшний', 'день', 'это', 'дело', 'стать', 'для', 'ты', 'главный', '?'];что
8509;Ты помнишь, на чем мы остановились?;8;['ты', 'помнить', ',', 'на', 'что', 'мы', 'остановиться', '?'];что
8511;Думаю, ты согласишься, что до сих пор мы видели вполне достоверные подтверждения моих умозаключений о жизни Вольдеморта до семнадцати лет?;23;['думать', ',', 'ты', 'согласиться', ',', 'что', 'до', 'сей', 'пора', 'мы', 'видеть', 'вполне', 'достоверный', 'подтверждение', 'мой', 'умозаключение', 'о', 'жизнь', 'вольдеморт', 'до', 'семнадцать', 'год', '?'];что
8520;Чему хотел учить?;4;['что', 'хотеть', 'учить', '?'];что
8527;Интересно, Том, знаете ли вы, что это?;11;['интересный', ',', 'том', ',', 'знать', 'ли', 'вы', ',', 'что', 'это', '?'];что
8529;Разве я не говорила, что происхожу от нее?;10;['разве', 'я', 'не', 'говорить', ',', 'что', 'происходить', 'от', 'она', '?'];что
8539;Итак, Том… чем обязан?;7;['итак', ',', 'том', '…', 'что', 'обязанный', '?'];что
8540;Ты называешь это «величием», то, чем ты занимался?;13;['ты', 'называть', 'это', '«', 'величие', '»', ',', 'то', ',', 'что', 'ты', 'заниматься', '?'];что
8557;Что у тебя за перо?;6;['что', 'у', 'ты', 'за', 'перо', '?'];что
8560;Что это?;3;['что', 'это', '?'];что
8561;Гарри, в чем дело?;6;['гарри', ',', 'в', 'что', 'дело', '?'];что
8566;Добби, а тебе не удалось подсмотреть, что он там делает?;13;['добби', ',', 'а', 'ты', 'не', 'удаться', 'подсмотреть', ',', 'что', 'он', 'там', 'делать', '?'];что
8568;А что это он говорил про «разных других школьников»?;12;['а', 'что', 'это', 'он', 'говорить', 'про', '«', 'разный', 'другой', 'школьник', '»', '?'];что
8570;Что стащить?;3;['что', 'стащить', '?'];что
8573;Что скажешь?;3;['что', 'сказать', '?'];что
8575;Что это может быть?;5;['что', 'это', 'мочь', 'быть', '?'];что
8582;А теперь, если вы соблаговолите открыть учебники на странице… в чем дело, мистер Финниган?;18;['а', 'теперь', ',', 'если', 'вы', 'соблаговолить', 'открыть', 'учебник', 'на', 'страница', '…', 'в', 'что', 'дело', ',', 'мистер', 'финниган', '?'];что
8600;Что ты тут делаешь?;5;['что', 'ты', 'тут', 'делать', '?'];что
8613;Вам не кажется, что она была… ну, знаете… влюблена в Сириуса?;16;['вы', 'не', 'казаться', ',', 'что', 'она', 'быть', '…', 'ну', ',', 'знать', '…', 'влюбить', 'в', 'сириус', '?'];что
8614;С чего ты взял?;5;['с', 'что', 'ты', 'взять', '?'];что
8624;Для чего?;3;['для', 'что', '?'];что
8625;Что может быть важнее этого воспоминания?;7;['что', 'мочь', 'быть', 'важнее', 'это', 'воспоминание', '?'];что
8638;А что за аромат?;5;['а', 'что', 'за', 'аромат', '?'];что
8643;Так что, Гарри, будешь принимать фортуну фортунату?;10;['так', 'что', ',', 'гарри', ',', 'быть', 'принимать', 'фортуна', 'фортунат', '?'];что
8644;О чем ты?;4;['о', 'что', 'ты', '?'];что
8648;Что хорошо?;3;['что', 'хороший', '?'];что
8650;Я чувствую, что сегодня должен быть именно там, понимаете?;12;['я', 'чувствовать', ',', 'что', 'сегодня', 'должный', 'быть', 'именно', 'там', ',', 'понимать', '?'];что
8653;Что это вы тутс ней?;6;['что', 'это', 'вы', 'тутс', 'она', '?'];что
8680;Боитесь, что он узнает о вашем участии?;9;['бояться', ',', 'что', 'он', 'узнавать', 'о', 'ваш', 'участие', '?'];что
8685;В честь чего столь поздний, хотя и приятный визит?;11;['в', 'честь', 'что', 'столь', 'поздний', ',', 'хотя', 'и', 'приятный', 'визит', '?'];что
8686;Сэр, а правда, что профессор Потешанс уходит на пенсию?;12;['сэр', ',', 'а', 'правда', ',', 'что', 'профессор', 'потешанс', 'уходить', 'на', 'пенсия', '?'];что
8696;Я что, похож на человека, который пробовал этим заниматься?;12;['я', 'что', ',', 'похожий', 'на', 'человек', ',', 'который', 'пробовать', 'это', 'заниматься', '?'];что
8720;Которые могут быть чем угодно?;6;['который', 'мочь', 'быть', 'что', 'угодно', '?'];что
8724;Вы представляете, что это может быть?;8;['вы', 'представлять', ',', 'что', 'это', 'мочь', 'быть', '?'];что
8742;Думаешь, все, что хранится в Зале Пророчеств, обязательно исполняется?;13;['думать', ',', 'весь', ',', 'что', 'храниться', 'в', 'зал', 'пророчество', ',', 'обязательно', 'исполняться', '?'];что
8751;Что бы ты тогда чувствовал к Вольдеморту?;8;['что', 'бы', 'ты', 'тогда', 'чувствовать', 'к', 'вольдеморт', '?'];что
8752;Ну… ты ведь рад, что все кончилось?;10;['ну', '…', 'ты', 'ведь', 'рад', ',', 'что', 'весь', 'кончиться', '?'];что
8753;С чего это вдруг?;5;['с', 'что', 'это', 'вдруг', '?'];что
8767;Расскажет ли он Дивангарду – тут у Гарри скрутило живот, – чему Гарри обязан поразительными успехами в зельеделии?;20;['рассказать', 'ли', 'он', 'дивангард', '–', 'тут', 'у', 'гарри', 'скрутить', 'живот', ',', '–', 'что', 'гарри', 'обязанный', 'поразительный', 'успех', 'в', 'зельеделий', '?'];что
8771;Это что,кровь?;5;['это', 'что', ',', 'кровь', '?'];что
8778;Знаешь, что я думаю, Поттер?;8;['знать', ',', 'что', 'я', 'думать', ',', 'поттер', '?'];что
8779;Что скажешь, Поттер?;5;['что', 'сказать', ',', 'поттер', '?'];что
8784;И что ты ответила?;5;['и', 'что', 'ты', 'ответить', '?'];что
